{
  "source": "Show Off Your AI Rig",
  "thread_id": "rigs",
  "url": "https://forum.level1techs.com/t/post-show-off-your-ai-rig-whatchya-got-in-there/255709",
  "count": 22,
  "items": [
    {
      "id": "rigs_post_2_0",
      "post_id": 4116228,
      "post_number": 2,
      "contributor": "MadGoat",
      "date": "2026-09-10",
      "gpu": {
        "model": "NVIDIA RTX A4000",
        "count": 8
      },
      "vram_total_gb": null,
      "cpu": "Intel Xeon E5-2697A v4",
      "ram_gb": 125.76,
      "storage": "1.73 TiB (btrfs)",
      "os": "EndeavourOS",
      "workload": "Vishva007/Qwen3.8-27B-W4A16-AutoRound-GPTQ via vLLM | 650k context",
      "notes": null,
      "preview": "I'll start it off: aigoat@aigoat OS: EndeavourOS x86_64 Host: Relion 2908GT (0100) Kernel: Linux 7.2.4-arch1-2 CPU: Intel(R) Xeon(R) E5-2697A v4 (32) @ 3.60 GHz GPU 1: ASPEED Technology, Inc. ASPEED Graphics Family GPU 2: NVIDIA RTX A4000 GPU 3: NVIDIA RTX A4000 GPU 4: NVIDIA RTX A4000 GPU 5: NVIDIA",
      "structured": true
    },
    {
      "id": "rigs_post_2_1",
      "post_id": 4116228,
      "post_number": 2,
      "contributor": "MadGoat",
      "date": "2026-09-10",
      "gpu": {
        "model": "NVIDIA Quadro RTX 5000",
        "count": 2
      },
      "vram_total_gb": null,
      "cpu": "AMD Ryzen 5 5600X",
      "ram_gb": 31.21,
      "storage": "883.03 GiB (btrfs)",
      "os": "EndeavourOS",
      "workload": "Qwen3.8-27b q4 unsloth gguf via llama.cpp | ~50ish tps via llama.cpp, not tea bag",
      "notes": null,
      "preview": "I'll start it off: aigoat@aigoat OS: EndeavourOS x86_64 Host: Relion 2908GT (0100) Kernel: Linux 7.2.4-arch1-2 CPU: Intel(R) Xeon(R) E5-2697A v4 (32) @ 3.60 GHz GPU 1: ASPEED Technology, Inc. ASPEED Graphics Family GPU 2: NVIDIA RTX A4000 GPU 3: NVIDIA RTX A4000 GPU 4: NVIDIA RTX A4000 GPU 5: NVIDIA",
      "structured": true
    },
    {
      "id": "rigs_post_3_0",
      "post_id": 4116229,
      "post_number": 3,
      "contributor": "SgtAwesomesauce",
      "date": "2026-09-10",
      "gpu": {
        "model": "AMD V620",
        "count": 4
      },
      "vram_total_gb": null,
      "cpu": "EPYC Rome 7532",
      "ram_gb": 128.0,
      "storage": "~5TB storage",
      "os": null,
      "workload": "Qwen3.8-flash-next via vLLM | Gets me ~70TPS of single-request inference and ~90TPS peak for 2-3 simultaneous streams",
      "notes": null,
      "preview": "Oh, you wanna see my m e ath lab? Epyc Rome 7532 128GB DDR4 Various NVMe totaling ~5TB of storage 4x AMD V620 All in an open air crypto-mining bench. No, this does not trip breakers, but it comes close. Current stack is a LiteLLM frontend to vLLM (I'll do a write-up on how I optimized vLLM soon), se",
      "structured": true
    },
    {
      "id": "rigs_post_4_0",
      "post_id": 4116230,
      "post_number": 4,
      "contributor": "patw",
      "date": "2026-09-11",
      "gpu": {
        "model": "5060 Ti",
        "count": 2
      },
      "vram_total_gb": 32.0,
      "cpu": "5700X",
      "ram_gb": 64.0,
      "storage": null,
      "os": "Ubuntu 26.04",
      "workload": "Qwen 3.8 27b via llama.cpp | 256k context",
      "notes": null,
      "preview": "Pretty boring compared to some of the posts here. Dual 5060ti 16g, 64 gig ddr4, 5700X on an MSI board, Meshify C case Ubuntu 26.04 (desktop even), llama.cpp (llama-server) Qwen 3.8 27b, Q4 weights, Q8 kv, sampler settings for coding, full 256k context. This machine runs a scheduled ralph loop, 12 ho",
      "structured": true
    },
    {
      "id": "rigs_post_8_0",
      "post_id": 4116252,
      "post_number": 8,
      "contributor": "oolmfoo",
      "date": "2026-09-11",
      "gpu": {
        "model": "3080",
        "count": 2
      },
      "vram_total_gb": 40.0,
      "cpu": "2x AMD EPYC 7532",
      "ram_gb": 512.0,
      "storage": null,
      "os": null,
      "workload": null,
      "notes": null,
      "preview": "Have this for a while, I'm just too busy to tinker with it. 2x AMD EPYC 7532 512 GB DDR4 3200 Some storage 2x 3080 20GB (Total 40GB)",
      "structured": true
    },
    {
      "id": "rigs_post_11_0",
      "post_id": 4116593,
      "post_number": 11,
      "contributor": "mattlach",
      "date": "2026-09-11",
      "gpu": {
        "model": "AMD Instinct MI210",
        "count": 1
      },
      "vram_total_gb": 64.0,
      "cpu": null,
      "ram_gb": null,
      "storage": null,
      "os": "Proxmox",
      "workload": null,
      "notes": null,
      "preview": "I wound up popping an AMD Instinct MI210 (64GB HBM2, 1600GB/s) into my existing main Proxmox node, and passing it through to a VM. So it is less of an \"AI rig\" and more of a large hypervisor that also has a VM that does AI stuff, as one of its uses. Turns out that despite having a proper server with",
      "structured": true
    },
    {
      "id": "rigs_post_14_0",
      "post_id": 4116597,
      "post_number": 14,
      "contributor": "mattlach",
      "date": "2026-09-11",
      "gpu": {
        "model": null,
        "count": null
      },
      "vram_total_gb": null,
      "cpu": null,
      "ram_gb": null,
      "storage": null,
      "os": null,
      "workload": null,
      "notes": null,
      "preview": "SgtAwesomesauce: The tech priests require art. MadGoat: You're gonna leave us hanging without proof of this described handy work? I can't be the left to be the only one showing off my superior cardboard skills... I'll be sure to take a pic the next time I have to open it up. But it ain't pretty. I p",
      "structured": false
    },
    {
      "id": "rigs_post_17_0",
      "post_id": 4116600,
      "post_number": 17,
      "contributor": "SgtAwesomesauce",
      "date": "2026-09-11",
      "gpu": {
        "model": null,
        "count": null
      },
      "vram_total_gb": null,
      "cpu": null,
      "ram_gb": null,
      "storage": null,
      "os": null,
      "workload": null,
      "notes": null,
      "preview": "Hey, I'm thoroughly jealous of the MI210. That's a lot of GB/s Plus, if it's jank, might break, and runs hot, it's worthy of respect in my book.",
      "structured": false
    },
    {
      "id": "rigs_post_18_0",
      "post_id": 4116603,
      "post_number": 18,
      "contributor": "mattlach",
      "date": "2026-09-11",
      "gpu": {
        "model": null,
        "count": null
      },
      "vram_total_gb": null,
      "cpu": null,
      "ram_gb": null,
      "storage": null,
      "os": null,
      "workload": "Gemma4:26b | It is, and it comes in handy sometimes (2500 tokens/s pre-fill and 80 tokens/s eval on Gemma4:26b) but it is a little bit more impressive at Q8_0 usually evaluates at about 25-30 tokens/s, which is less exciting than I had hope",
      "notes": null,
      "preview": "SgtAwesomesauce: Hey, I'm thoroughly jealous of the MI210. That's a lot of GB/s It is, and it comes in handy sometimes (2500 tokens/s pre-fill and 80 tokens/s eval on Gemma4:26b) but it is a little bit more impressive on paper than it is in reality (something I didn't realize until after I bought it",
      "structured": false
    },
    {
      "id": "rigs_post_19_0",
      "post_id": 4116608,
      "post_number": 19,
      "contributor": "SgtAwesomesauce",
      "date": "2026-09-11",
      "gpu": {
        "model": "V620",
        "count": 4
      },
      "vram_total_gb": null,
      "cpu": null,
      "ram_gb": null,
      "storage": null,
      "os": null,
      "workload": "Qwen3.8-flash-next | That's how I went from 20t/s on my stack to up to 90 /mi210-llm-stack My 4x v620s does about 1200TPS prefill with qwen3.8-flash-next",
      "notes": null,
      "preview": "mattlach: It turns out AMD's ecosystem is nowhere near as optimized as Nvidia's, so when it comes to efficiency, I rarely get more than 60% of the theoretical max throughput, which is a bit of a bummer. But it is still quite nice. Have you built an optimized stack for it? You might want to take a lo",
      "structured": true
    },
    {
      "id": "rigs_post_20_0",
      "post_id": 4116610,
      "post_number": 20,
      "contributor": "mattlach",
      "date": "2026-09-11",
      "gpu": {
        "model": null,
        "count": null
      },
      "vram_total_gb": null,
      "cpu": null,
      "ram_gb": null,
      "storage": null,
      "os": null,
      "workload": null,
      "notes": null,
      "preview": "SgtAwesomesauce: Have you built an optimized stack for it? You might want to take a look at this repo, if you're just throwing llama.cpp at it and crossing your fingers, AMD stacks really need a bunch of custom patches and optimizations, especially for the older stuff. That's how I went from 20t/s o",
      "structured": false
    },
    {
      "id": "rigs_post_22_0",
      "post_id": 4116695,
      "post_number": 22,
      "contributor": "mashie",
      "date": "2026-09-11",
      "gpu": {
        "model": "DGX Spark",
        "count": 4
      },
      "vram_total_gb": null,
      "cpu": null,
      "ram_gb": null,
      "storage": null,
      "os": null,
      "workload": "DeepSeek v4.1 Flash",
      "notes": null,
      "preview": "My setup. 4xDGX Sparks running as 2+2 while sorting out the switches. Can't wait to fire up DeepSeek v4.1 Flash on these in the near future.",
      "structured": true
    },
    {
      "id": "rigs_post_24_0",
      "post_id": 4117146,
      "post_number": 24,
      "contributor": "digitalscream",
      "date": "2026-09-13",
      "gpu": {
        "model": "R9700",
        "count": 2
      },
      "vram_total_gb": null,
      "cpu": "5700X",
      "ram_gb": 128.0,
      "storage": "2TB MLC",
      "os": null,
      "workload": "Qwen 3.8 27B FP8 via vllm-radiance | Roughly 3200t/s prefill, 80t/s general generation, 120t/s code gen",
      "notes": null,